latitude,longitude,station_id,station_name,original_city,original_state,street_address,city,state,zip_code,geocoded_at,geocoding_source
39.844019,-84.195617,349026,Home2 Suites by Hilton Dayton Vandalia - Tesla Destination,Dayton,OH,"Home2 Suites, 6615, Town Center Drive, York Commons - Miller Lane, Dayton, Butler Township, Montgomery County, Ohio, 45414, United States",Dayton,Ohio,45414,2025-10-14T15:36:30.029698,Nominatim
39.844885,-84.187036,349029,DOAE JATC DAYTON JATC,Dayton,OH,"3896, Space Drive, Vandalia, Montgomery County, Ohio, 45414, United States",Vandalia,Ohio,45414,2025-10-14T15:36:31.479881,Nominatim
39.845841,-84.427227,349031,McDonald's 40 Triggs Rd,Brookville,OH,"Triggs Road, Brookville, Montgomery County, Ohio, 45309, United States",Brookville,Ohio,45309,2025-10-14T15:36:32.979312,Nominatim
39.846085,-84.412838,349032,MVRPC(EV#3),Brookville,OH,"East Upper Lewisburg Salem Road, Brookville, Clay Township, Montgomery County, Ohio, 45309, United States",Brookville,Ohio,45309,2025-10-14T15:36:34.389445,Nominatim
39.850292,-82.992561,349044,Google,Columbus,OH,"Parsons Avenue, Columbus, Hamilton Township, Franklin County, Ohio, 43137, United States",Columbus,Ohio,43137,2025-10-14T15:36:35.998743,Nominatim
39.850485,-84.188308,349046,Evans Volkswagen,Dayton,OH,"Evans Motorworks, Park Center Drive, North Dayton, Vandalia, Montgomery County, Ohio, 45414, United States",Vandalia,Ohio,45414,2025-10-14T15:36:37.442478,Nominatim
39.858702,-84.277027,349065,Meijer - Tesla Supercharger,Dayton,OH,"Tesla Supercharger, 9200, North Main Street, Morgan Place, Dayton, Montgomery County, Ohio, 45445, United States",Dayton,Ohio,45445,2025-10-14T15:36:38.916314,Nominatim
39.860594,-82.831534,349071,JEFF WYLER EXPR PLUS PL,Canal Winchester,OH,"Jeff Wyler Chevrolet, Southeast Expressway, Canal Winchester, Madison Township, Franklin County, Ohio, 43110, United States",Canal Winchester,Ohio,43110,2025-10-14T15:36:40.217660,Nominatim
39.863155,-84.130719,349080,CLOUD CITY HALL 1,Dayton,OH,"7525, Mount Rainier, Huber Heights, Montgomery County, Ohio, 45424, United States",Huber Heights,Ohio,45424,2025-10-14T15:36:41.838586,Nominatim
39.871975,-84.221,349100,Rec Center,Dayton,OH,"999, Stonequarry Road, Vandalia, Butler Township, Montgomery County, Ohio, 45414, United States",Vandalia,Ohio,45414,2025-10-14T15:36:43.217508,Nominatim
39.875251,-84.268575,349107,MVRPC(EV#23),Dayton,OH,"Meeker Road, Little York, Butler Township, Montgomery County, Ohio, 45414, United States",,Ohio,45414,2025-10-14T15:36:44.821264,Nominatim
39.875477,-84.0935,349110,MVRPC(EV#20),Dayton,OH,"Shull Road, Huber Heights, Montgomery County, Ohio, 45424, United States",Huber Heights,Ohio,45424,2025-10-14T15:36:46.095853,Nominatim
39.876256,-84.220533,349114,Rec Center Soccer Fields,Vandalia,OH,"Ricci Street, Vandalia, Montgomery County, Ohio, 45377, United States",Vandalia,Ohio,45377,2025-10-14T15:36:47.542955,Nominatim
39.878483,-82.931627,349119,"4375 Alum Creek Dr., Obetz",Obetz,OH,"Sheetz, 4375, Alum Creek Drive, Obetz, Hamilton Township, Franklin County, Ohio, 43207, United States",Obetz,Ohio,43207,2025-10-14T15:36:48.883189,Nominatim
39.887307,-84.197032,349149,MVRPC(EV#17),Vandalia,OH,"Vandalia-Butler Stadium, Scott Avenue, Vandalia, Montgomery County, Ohio, 45377, United States",Vandalia,Ohio,45377,2025-10-14T15:36:50.352923,Nominatim
39.888127,-82.888653,349153,RICART Auto Mall DCFC,Groveport,OH,"Williams Road, Columbus, Madison Township, Franklin County, Ohio, 43232, United States",Columbus,Ohio,43232,2025-10-14T15:36:51.689864,Nominatim
39.888206,-82.8859,349154,Ricart Ford,Groveport,OH,"Ricart Used Car Factory, 4255, South Hamilton Road, Groveport, Franklin County, Ohio, 43125, United States",Groveport,Ohio,43125,2025-10-14T15:36:53.121152,Nominatim
39.888499,-82.887765,349157,Ford Charge - Ricart Ford,Groveport,OH,"Williams Road, Columbus, Madison Township, Franklin County, Ohio, 43232, United States",Columbus,Ohio,43232,2025-10-14T15:36:54.419088,Nominatim
39.888536,-84.217077,349158,Beau Townsend S7,Vandalia,OH,"Ford, National Road, Vandalia, Montgomery County, Ohio, 45377, United States",Vandalia,Ohio,45377,2025-10-14T15:36:55.851099,Nominatim
39.889568,-82.887489,349161,Ricart Megamall,Groveport,OH,"Southeast Expressway, Columbus, Franklin County, Ohio, 43232, United States",Columbus,Ohio,43232,2025-10-14T15:36:57.205122,Nominatim
39.889721,-84.198325,349162,Senior Center,Vandalia,OH,"22, Kenbrook Drive, Vandalia, Montgomery County, Ohio, 45377, United States",Vandalia,Ohio,45377,2025-10-14T15:36:58.768530,Nominatim
39.891016,-84.171913,349169,Golf Course Parking lot,Vandalia,OH,"66, Clubhouse Way, Vandalia, Montgomery County, Ohio, 45377, United States",Vandalia,Ohio,45377,2025-10-14T15:37:00.044211,Nominatim
39.891686,-83.444715,349172,Buckeye Ford S7,London,OH,"100, Lafayette Road, London Commercial Business Historic District, London, Madison County, Ohio, 43140, United States",London,Ohio,43140,2025-10-14T15:37:01.501909,Nominatim
39.891741,-82.887792,349174,RICART KIA CUST PARKIN,Groveport,OH,"Ricart Kia, 4255, Southeast Expressway, Groveport, Franklin County, Ohio, 43125, United States",Groveport,Ohio,43125,2025-10-14T15:37:02.904877,Nominatim
39.892574,-84.195248,349180,Justice Center Parking Lot,Vandalia,OH,"240, James E. Bohanan Memorial Drive, Vandalia, Montgomery County, Ohio, 45377, United States",Vandalia,Ohio,45377,2025-10-14T15:37:04.477640,Nominatim
39.892708,-84.193004,349182,Municipal Bldg,Vandalia,OH,"James E. Bohanan Memorial Drive, Vandalia, Montgomery County, Ohio, 45377, United States",Vandalia,Ohio,45377,2025-10-14T15:37:05.761953,Nominatim
39.895071,-83.71992,349189,"1751 Titus Rd, Springfield",Springfield,OH,"Sheetz, 1751, Titus Road, Springfield, Clark County, Ohio, 45502, United States",Springfield,Ohio,45502,2025-10-14T15:37:07.200751,Nominatim
39.902211,-84.148192,349202,Aileron - Tesla Destination,Tipp City,OH,"Wildcat Road, Huber Heights, Miami County, Ohio, 45371, United States",Huber Heights,Ohio,45371,2025-10-14T15:37:08.496956,Nominatim
39.912202,-83.09802,349237,Brookfield Village Apartments,Grove City,OH,"2085, Kirkham Square Drive, Hilltop, Columbus, Franklin County, Ohio, 43123, United States",Columbus,Ohio,43123,2025-10-14T15:37:09.967404,Nominatim
39.912824,-82.781939,349242,PICK TOWN PMH 4 NORTH LOT,PICKERINGTON,OH,"OhioHealth Pickerington Methodist Hospital, 1010, Refugee Road, Refugee Road Medical Corridor, Pickerington, Violet Township, Fairfield County, Ohio, 43147, United States",Pickerington,Ohio,43147,2025-10-14T15:37:11.248669,Nominatim
39.912957,-82.783432,349244,PICK TOWN PMH 2 ER LOT,PICKERINGTON,OH,"OhioHealth Pickerington Methodist Hospital, 1010, Refugee Road, Refugee Road Medical Corridor, Pickerington, Violet Township, Fairfield County, Ohio, 43147, United States",Pickerington,Ohio,43147,2025-10-14T15:37:12.685231,Nominatim
39.915117,-82.782059,349262,Shoppes at Stonecreek,Pickerington,OH,"1550, Stonecreek Drive, Refugee Road Medical Corridor, Pickerington, Violet Township, Fairfield County, Ohio, 43147, United States",Pickerington,Ohio,43147,2025-10-14T15:37:13.982617,Nominatim
39.922997,-83.124815,349313,GERMAIN VW GERMAIN KIA L3,Columbus,OH,"Hatfield Kia, 1455, Auto Mall Drive, Columbus, Franklin County, Ohio, 43328, United States",Columbus,Ohio,43328,2025-10-14T15:37:15.514473,Nominatim
39.925626,-82.832087,349327,"2727 Brice Road, Reynoldsburg",Reynoldsburg,OH,"IONNA, 2727, Brice Road, Reynoldsburg, Franklin County, Ohio, 43232, United States",Reynoldsburg,Ohio,43232,2025-10-14T15:37:17.016879,Nominatim
39.929374,-83.125545,349371,"Applied Electric, LLC - Performance CJDR",Columbus,OH,"Auto Mall Parkway, Columbus, Franklin County, Ohio, 43328, United States",Columbus,Ohio,43328,2025-10-14T15:37:18.482535,Nominatim
39.936161,-83.406882,349397,Buckeye Ford London DCFC,London,OH,"66, Old US Hwy 42 Southeast, Lafayette, Deer Creek Township, Madison County, Ohio, 43140, United States",,Ohio,43140,2025-10-14T15:37:19.779242,Nominatim
39.937154,-82.006498,349400,Ford Charge - Dutro Ford,Zanesville,OH,"Dutro Auto, 132, South 5th Street, Zanesville, Muskingum County, Ohio, 43701, United States",Zanesville,Ohio,43701,2025-10-14T15:37:21.310510,Nominatim
39.942357,-83.833992,349433,JEFF WYLER POWER LINK,Springfield,OH,"West 1st Street, Snyder Terrace, Springfield, Clark County, Ohio, 45504, United States",Springfield,Ohio,45504,2025-10-14T15:37:22.608024,Nominatim
39.942384,-82.599217,349435,Flying J 699,Millersport,OH,"Flying J, Baltimore Road Southwest, Kirkersville, Harrison Township, Licking County, Ohio, 43046, United States",Kirkersville,Ohio,43046,2025-10-14T15:37:24.044575,Nominatim
39.944011,-82.005212,349444,MCLS MUSKINGUM DCFC2,Zanesville,OH,"John McIntire Library, 220, North 5th Street, Zanesville, Muskingum County, Ohio, 43701, United States",Zanesville,Ohio,43701,2025-10-14T15:37:25.405239,Nominatim
39.946364,-82.925516,349457,BROOKWOOD POINT CT 4000 #1,Columbus,OH,"Brookwood Road, Berwick, Columbus, Franklin County, Ohio, 43209, United States",Columbus,Ohio,43209,2025-10-14T15:37:26.997413,Nominatim
39.948896,-83.000891,349469,Kroger Brewers Yard,Columbus,OH,"Bank Street, Brewery District, Columbus, Franklin County, Ohio, 43206, United States",Columbus,Ohio,43206,2025-10-14T15:37:28.341782,Nominatim
39.950677,-83.002017,349481,MORPC MORPC 2,Columbus,OH,"Liberty Street, Brewery District, Columbus, Franklin County, Ohio, 43216, United States",Columbus,Ohio,43216,2025-10-14T15:37:29.937755,Nominatim
39.952637,-82.991905,349496,NATIONWIDECHILD NCH-W30 EV 4,Columbus,OH,"German Village Chiropractors, 247, East Livingston Avenue, German Village, Columbus, Franklin County, Ohio, 43215, United States",Columbus,Ohio,43215,2025-10-14T15:37:31.357308,Nominatim
39.952676,-82.942666,349498,Schneider Park,Columbus,OH,"Astor Avenue, Bexley, Franklin County, Ohio, 43209, United States",Bexley,Ohio,43209,2025-10-14T15:37:34.179907,Nominatim
39.952798,-82.986303,349503,NATIONWIDECHILD NCH-AG ST1,Columbus,OH,"Butterfly Gardens Gateway, Livingston Park, Near East Side, Columbus, Franklin County, Ohio, 43206, United States",Columbus,Ohio,43206,2025-10-14T15:37:35.509886,Nominatim
39.953134,-83.379649,349510,"TA, 940 US RT 42 NE, OH",London,OH,"TA, Holiday Trail Northeast, Deer Creek Township, Madison County, Ohio, United States",,Ohio,,2025-10-14T15:37:38.311195,Nominatim
39.95449,-83.00586,349521,2 Miranova Place,Columbus,OH,"Two Miranova Place Parking Garage, West Mound Street, River South, Columbus, Franklin County, Ohio, 43216, United States",Columbus,Ohio,43216,2025-10-14T15:37:39.619147,Nominatim
39.955447,-82.803619,349540,REYNOLDSBURG LEVEL 2 STATION,Reynoldsburg,OH,"Lancaster Avenue, Reynoldsburg, Truro Township, Franklin County, Ohio, 43068, United States",Reynoldsburg,Ohio,43068,2025-10-14T15:37:41.076618,Nominatim
39.955481,-82.769261,349541,Sheetz Store #822 - Reynoldsburg,Reynoldsburg,OH,"East Main Street, Reynoldsburg, Etna Township, Licking County, Ohio, 43068, United States",Reynoldsburg,Ohio,43068,2025-10-14T15:37:42.404062,Nominatim
39.956995,-82.998059,349554,COLUMBUS COMMON STATION 3,Columbus,OH,"Columbus Commons Garage, 55, East Rich Street, River South, Columbus, Franklin County, Ohio, 43215, United States",Columbus,Ohio,43215,2025-10-14T15:37:43.858079,Nominatim
39.957353,-82.997863,349558,COLUMBUS COMMON STATION 2,Columbus,OH,"Columbus Commons Garage, 55, East Rich Street, River South, Columbus, Franklin County, Ohio, 43215, United States",Columbus,Ohio,43215,2025-10-14T15:37:45.182286,Nominatim
39.95907,-83.010329,349576,STARLINGSTREET N06,Columbus,OH,"Parking Garage 2, Starling Street, ONE at the Peninsula, Columbus, Franklin County, Ohio, 43216, United States",Columbus,Ohio,43216,2025-10-14T15:37:46.656110,Nominatim
39.959109,-83.010499,349578,STARLINGSTREET N01,Columbus,OH,"Parking Garage 2, Starling Street, ONE at the Peninsula, Columbus, Franklin County, Ohio, 43216, United States",Columbus,Ohio,43216,2025-10-14T15:37:47.999366,Nominatim
39.959901,-82.99231,349587,GMC BLUE GARAGE 2,COLUMBUS,OH,"East Town Street, Discovery District, Columbus, Franklin County, Ohio, 43216, United States",Columbus,Ohio,43216,2025-10-14T15:37:49.589469,Nominatim
39.96129,-83.001812,349601,HUNTINGTON CENT STATION 2,Columbus,OH,"Huntington Center & Double Tree Suites Parking, South Front Street, Civic Center, Columbus, Franklin County, Ohio, 43216, United States",Columbus,Ohio,43216,2025-10-14T15:37:50.920419,Nominatim
39.961347,-82.991095,349602,BLOM ADMIN GMCMOB BLUE 13,Columbus,OH,"Grant Family Medicine, Oak Street, Discovery District, Columbus, Franklin County, Ohio, 43216, United States",Columbus,Ohio,43216,2025-10-14T15:37:52.411555,Nominatim
39.962096,-82.994714,349614,195 E. Broad Street Garage,Columbus,OH,"East Capital Street, Downtown, Columbus, Franklin County, Ohio, 43216, United States",Columbus,Ohio,43216,2025-10-14T15:37:53.713117,Nominatim
39.964328,-83.044816,349631,COTA COTA 4,Columbus,OH,"McKinley Avenue, Columbus, Franklin County, Ohio, 43222, United States",Columbus,Ohio,43222,2025-10-14T15:37:55.155041,Nominatim
39.964798,-83.045662,349633,COTA COTA 6,Columbus,OH,"McKinley Avenue, Columbus, Franklin County, Ohio, 43222, United States",Columbus,Ohio,43222,2025-10-14T15:37:56.450838,Nominatim
39.964985,-83.045726,349636,COTA COTA 5,Columbus,OH,"McKinley Avenue, Columbus, Franklin County, Ohio, 43222, United States",Columbus,Ohio,43222,2025-10-14T15:37:58.013828,Nominatim
39.965,-83.006,349637,AEP - Unassigned Garage,Columbus,OH,"American Electric Power, 1, Riverside Plaza, Civic Center, Columbus, Franklin County, Ohio, 43215, United States",Columbus,Ohio,43215,2025-10-14T15:37:59.369693,Nominatim
39.965917,-81.899182,349644,Best Western - Zanesville,Zanesville,OH,"East Pike, Muskingum County, Ohio, United States",,Ohio,,2025-10-14T15:38:00.936058,Nominatim
39.966132,-82.876602,349645,Byers Chrysler - DCFC,Columbus,OH,"442, Whitehall Drive, Whitehall, Franklin County, Ohio, 43213, United States",Whitehall,Ohio,43213,2025-10-14T15:38:02.231821,Nominatim
39.968063,-83.000658,349662,LAZ COLUMBUS OH CHESTNUT 01,Columbus,OH,"North Pearl Street, High Street Corridor, Columbus, Franklin County, Ohio, 43215, United States",Columbus,Ohio,43215,2025-10-14T15:38:03.680642,Nominatim
39.968332,-83.018556,349666,ASTORPARKGARAGE APG-4,Columbus,OH,"Columbus Crew Way, Columbus, Franklin County, Ohio, 43215, United States",Columbus,Ohio,43215,2025-10-14T15:38:05.030754,Nominatim
39.968359,-83.004,349667,LAZ COLUMBUS OH FRONT ST 2,Columbus,OH,"North Front Street, Arena District, Columbus, Franklin County, Ohio, 43215, United States",Columbus,Ohio,43215,2025-10-14T15:38:06.498113,Nominatim
39.969087,-83.008128,349674,LAZ COLUMBUS OH JMG 1,Columbus,OH,"McConnell Garage, 355, John H. McConnell Boulevard, Arena District, Columbus, Franklin County, Ohio, 43215, United States",Columbus,Ohio,43215,2025-10-14T15:38:07.748348,Nominatim
39.969901,-81.534058,349680,Dollar General - Byesville,Byesville,OH,"104, 1st Street, Byesville, Guernsey County, Ohio, 43723, United States",Byesville,Ohio,43723,2025-10-14T15:38:09.225475,Nominatim
39.971065,-82.99974,349683,Ohio Center Garage,Columbus,OH,"Convention Center Drive, Warehouse District, Columbus, Franklin County, Ohio, 43215, United States",Columbus,Ohio,43215,2025-10-14T15:38:10.553677,Nominatim
39.971824,-82.943841,349687,Jeffrey Park,Bexley,OH,"Clifton Avenue, North Bexley Area, Bexley, Franklin County, Ohio, 43209, United States",Bexley,Ohio,43209,2025-10-14T15:38:12.033766,Nominatim
39.973909,-83.026458,349700,Southern Station BAE701527,Columbus,OH,"Swan Street, Grandview Yard, Grandview Heights, Franklin County, Ohio, 43212, United States",Grandview Heights,Ohio,43212,2025-10-14T15:38:14.607506,Nominatim
39.97424,-83.00077,349704,"Columbus, OH (Wall Connector) - Tesla Destination",Columbus,OH,"70, East Goodale Street, Jeffrey Park, Columbus, Franklin County, Ohio, 43215, United States",Columbus,Ohio,43215,2025-10-14T15:38:16.141847,Nominatim
39.974322,-83.000802,349706,Goodale Garage - Tesla Supercharger,Columbus,OH,"70, East Goodale Street, Jeffrey Park, Columbus, Franklin County, Ohio, 43215, United States",Columbus,Ohio,43215,2025-10-14T15:38:17.430838,Nominatim
39.97458,-83.01927,349710,600 W Goodale St,Columbus,OH,"Olentangy Trail (Extension), Harrison West, Columbus, Franklin County, Ohio, 43201, United States",Columbus,Ohio,43201,2025-10-14T15:38:18.928317,Nominatim
39.977567,-82.760323,349737,The Residences at Eastwood - Leasing Center,Reynoldsburg,OH,"9068, Ridgeline Drive, Reynoldsburg, Licking County, Ohio, 43068, United States",Reynoldsburg,Ohio,43068,2025-10-14T15:38:20.236659,Nominatim
39.978315,-82.842182,349742,MCE N GARAGE -2 MCE 1,Columbus,OH,"Mount Carmel East Hospital, 6001, East Broad Street, Columbus, Franklin County, Ohio, 43213, United States",Columbus,Ohio,43213,2025-10-14T15:38:21.799190,Nominatim
39.979736,-82.993913,349752,JPG NEW STATION 1,Columbus,OH,"800, Waldron Street, Italian Village, Columbus, Franklin County, Ohio, 43215, United States",Columbus,Ohio,43215,2025-10-14T15:38:23.139597,Nominatim
39.981959,-82.830494,349771,TRU - E BROAD TRU EAST BROAD,Columbus,OH,"58, Outerbelt Street, Columbus, Franklin County, Ohio, 43213, United States",Columbus,Ohio,43213,2025-10-14T15:38:24.624305,Nominatim
39.981991,-83.171274,349772,VCMEADOWS VC MEADOWS 2,Hilliard,OH,"Boes Court, Norwich Township, Franklin County, Ohio, 43026, United States",,Ohio,43026,2025-10-14T15:38:25.975547,Nominatim
39.982689,-83.026403,349776,LAZ COLUMBUS OH GVY NORTH 01,Grandview Heights,OH,"Junction Way, Grandview Yard, Grandview Heights, Franklin County, Ohio, 43212, United States",Grandview Heights,Ohio,43212,2025-10-14T15:38:27.512091,Nominatim
39.984666,-83.026359,349790,GetGo Caf√© + Market - Tesla Supercharger,Columbus,OH,"Tesla Supercharger, 820, West 3rd Avenue, Fifth by Northwest, Columbus, Franklin County, Ohio, 43212, United States",Columbus,Ohio,43212,2025-10-14T15:38:28.774942,Nominatim
39.985134,-82.872069,349794,VW SHOWROOM VW AUDI SHOP,Columbus,OH,"East 5th Avenue, East Columbus, Columbus, Franklin County, Ohio, 43213, United States",Columbus,Ohio,43213,2025-10-14T15:38:30.331370,Nominatim
39.985216,-82.870519,349795,Byers Imports DCFC,Columbus,OH,"Byers Airport Subaru, 401, Hamilton Road, Whitehall, Franklin County, Ohio, 43213, United States",Whitehall,Ohio,43213,2025-10-14T15:38:31.681138,Nominatim
39.985966,-83.0258,349801,INDUS HOTEL ALOFT 1,Columbus,OH,"Aloft Columbus University District, Olentangy River Road, Fifth by Northwest, Columbus, Franklin County, Ohio, 43212, United States",Columbus,Ohio,43212,2025-10-14T15:38:33.153871,Nominatim
39.986165,-83.00562,349803,Go Share High Street Mobility Hub,Columbus,OH,"West Greenwood Avenue, Victorian Village, Columbus, Franklin County, Ohio, 43201, United States",Columbus,Ohio,43201,2025-10-14T15:38:34.574479,Nominatim
39.987355,-83.03106,349809,Parking Garage Basement,Columbus,OH,"948, South Avenue, Fifth by Northwest, Columbus, Franklin County, Ohio, 43212, United States",Columbus,Ohio,43212,2025-10-14T15:38:36.101112,Nominatim
39.98736,-84.202363,349810,Dave Arbogast Buick-GMC,TROY,OH,"I 75, Tipp City, Miami County, Ohio, 45373, United States",Tipp City,Ohio,45373,2025-10-14T15:38:37.465424,Nominatim
39.98872,-81.57502,349819,Walmart 3262 Cambridge,Cambridge,OH,"Southgate Road, Cambridge, Guernsey County, Ohio, 43725, United States",Cambridge,Ohio,43725,2025-10-14T15:38:38.956582,Nominatim
39.98878,-83.05917,349822,MARBLE CLIFF MC NORTH,Columbus,OH,"1596, Fernwood Avenue, Marble Cliff, Franklin County, Ohio, 43212, United States",Marble Cliff,Ohio,43212,2025-10-14T15:38:40.497425,Nominatim
39.989245,-83.042679,349829,5xNW,Columbus,OH,"1345, West 6th Avenue, Fifth by Northwest, Columbus, Franklin County, Ohio, 43212, United States",Columbus,Ohio,43212,2025-10-14T15:38:42.119146,Nominatim
39.99078,-82.02533,349838,JEFF DRENNEN CADILLAC OF ZANESVILLE,ZANESVILLE,OH,"Jeff Drennen Chevrolet Buick GMC Cadillac, 3625, Maple Avenue, Zanesville, Muskingum County, Ohio, 43701, United States",Zanesville,Ohio,43701,2025-10-14T15:38:43.470966,Nominatim
39.992284,-82.474666,349848,COUGHLIN EV REAR,Heath,OH,"James Parkway, Heath, Licking County, Ohio, 43056, United States",Heath,Ohio,43056,2025-10-14T15:38:44.979422,Nominatim
39.993138,-83.015898,349858,OHIO STATE UNV 9TH EAST GARAGE,Columbus,OH,"9th Avenue East Garage, 345, West Ninth Avenue, University District District 4, Columbus, Franklin County, Ohio, 43210, United States",Columbus,Ohio,43210,2025-10-14T15:38:46.277869,Nominatim
39.99331,-82.98136,349859,COTA LINDEN #1,Columbus,OH,"922, Bonham Avenue, South Linden, Columbus, Franklin County, Ohio, 43211, United States",Columbus,Ohio,43211,2025-10-14T15:38:47.838732,Nominatim
39.993346,-82.981413,349861,COTA LINDEN #2,Columbus,OH,"916, Bonham Avenue, South Linden, Columbus, Franklin County, Ohio, 43211, United States",Columbus,Ohio,43211,2025-10-14T15:38:49.139377,Nominatim
39.994178,-83.005558,349867,OHIO STATE UNV GATEWAY GARAGE,Columbus,OH,"Gateway Garage, 75, North Pearl Street, Weinland Park, Columbus, Franklin County, Ohio, 43201, United States",Columbus,Ohio,43201,2025-10-14T15:38:50.717051,Nominatim
39.997764,-82.906654,349885,CMH AIRPORT EV RED EV-1,Columbus,OH,"Red Lot, Stelzer Road, Columbus, Sharon, Franklin County, Ohio, 43219, United States",Columbus,Ohio,43219,2025-10-14T15:38:52.015363,Nominatim
39.997949,-82.906633,349887,CMH AIRPORT EV RED EV-6,Columbus,OH,"Red Lot, Stelzer Road, Columbus, Sharon, Franklin County, Ohio, 43219, United States",Columbus,Ohio,43219,2025-10-14T15:38:53.488975,Nominatim
39.997975,-82.887576,349888,CMH AIRPORT EV GARAGEEV#3,Columbus,OH,"Post-Security Concourse, East Columbus, Columbus, Sharon, Franklin County, Ohio, 43213, United States",Columbus,Ohio,43213,2025-10-14T15:38:54.826065,Nominatim
39.998004,-82.906624,349891,CMH AIRPORT EV RED EV-7,Columbus,OH,"Red Lot, Stelzer Road, Columbus, Sharon, Franklin County, Ohio, 43219, United States",Columbus,Ohio,43219,2025-10-14T15:38:56.246049,Nominatim
39.998074,-82.906615,349893,CMH AIRPORT EV RED EV-9,Columbus,OH,"Red Lot, Stelzer Road, Columbus, Sharon, Franklin County, Ohio, 43219, United States",Columbus,Ohio,43219,2025-10-14T15:38:57.482774,Nominatim
39.998108,-82.887514,349894,CMH AIRPORT EV GARAGEEV#6,Columbus,OH,"Post-Security Concourse, East Columbus, Columbus, Sharon, Franklin County, Ohio, 43213, United States",Columbus,Ohio,43213,2025-10-14T15:38:58.982686,Nominatim
39.998129,-82.906616,349895,CMH AIRPORT EV RED EV-10,Columbus,OH,"Red Lot, Stelzer Road, Columbus, Sharon, Franklin County, Ohio, 43219, United States",Columbus,Ohio,43219,2025-10-14T15:39:00.223172,Nominatim
39.998133,-82.88746,349896,CMH AIRPORT EV GARAGEEV#7,Columbus,OH,"Post-Security Concourse, East Columbus, Columbus, Sharon, Franklin County, Ohio, 43213, United States",Columbus,Ohio,43213,2025-10-14T15:39:01.654543,Nominatim
39.999614,-82.845507,349911,Burns & Scalo Ohio Inc-,Columbus,OH,"892, Tech Center Drive, Gahanna, Mifflin Township, Franklin County, Ohio, 43230, United States",Gahanna,Ohio,43230,2025-10-14T15:39:02.989357,Nominatim
40.003569,-81.574967,349935,Sheetz - Tesla Supercharger,Cambridge,OH,"Tesla Supercharger, 2101, Southgate Parkway, Cambridge, Guernsey County, Ohio, 43725, United States",Cambridge,Ohio,43725,2025-10-14T15:39:04.435546,Nominatim
40.004565,-82.66126,349944,Coughlin Chevrolet of Pataskala,Pataskala,OH,"Lois Lane, Pataskala, Harrison Township, Licking County, Ohio, 43062, United States",Pataskala,Ohio,43062,2025-10-14T15:39:05.731382,Nominatim
40.005882,-83.104789,349954,CITY OF UA PCS-ROBERTS RD2,Columbus,OH,"4046, Roberts Road, Columbus, Franklin County, Ohio, 43228, United States",Columbus,Ohio,43228,2025-10-14T15:39:07.469988,Nominatim
40.006424,-83.046835,349958,LAZ PARKING COL AGW 4,Columbus,OH,"Arlington Gateway, 1349, West Lane Avenue, Columbus, Sharon, Franklin County, Ohio, 43221, United States",Columbus,Ohio,43221,2025-10-14T15:39:08.888842,Nominatim
40.006433,-82.889269,349959,American Electric Power HQ - Tesla Destination,Columbus,OH,"4489, Bridgeway Avenue, Columbus, Sharon, Franklin County, Ohio, 43219, United States",Columbus,Ohio,43219,2025-10-14T15:39:10.358312,Nominatim
40.006465,-83.046867,349960,LAZ PARKING COL AGW 3,Columbus,OH,"Arlington Gateway, 1349, West Lane Avenue, Columbus, Sharon, Franklin County, Ohio, 43221, United States",Columbus,Ohio,43221,2025-10-14T15:39:11.637287,Nominatim
40.006654,-83.046846,349963,LAZ PARKING COL AGW 1,Columbus,OH,"Arlington Gateway, 1349, West Lane Avenue, Columbus, Sharon, Franklin County, Ohio, 43221, United States",Columbus,Ohio,43221,2025-10-14T15:39:14.626156,Nominatim
40.006804,-82.986053,349965,OHC-CCC #1 CCC #1,Columbus,OH,"I 71, Columbus, Sharon, Franklin County, Ohio, 43211, United States",Columbus,Ohio,43211,2025-10-14T15:39:15.965899,Nominatim
40.007412,-83.049717,349968,UPPER ARLINGTON LANE AVE MOB 1,UPPER ARLINGTON,OH,"Vassar Pop-Up Park, Upper Arlington, Sharon, Franklin County, Ohio, 43221, United States",Upper Arlington,Ohio,43221,2025-10-14T15:39:17.455565,Nominatim
40.010377,-82.461768,349988,Hinderer Honda Heath DCFC's,Heath,OH,"John Hinderer Honda, 1515, Hebron Road Southeast, Heath, Licking County, Ohio, 43056, United States",Heath,Ohio,43056,2025-10-14T15:39:18.806869,Nominatim
40.011047,-83.037714,349996,OHIO STATE UNV KUNZ-BRUNDIGE,Columbus,OH,"Carmack Road, Columbus, Sharon, Franklin County, Ohio, 43221, United States",Columbus,Ohio,43221,2025-10-14T15:39:20.312520,Nominatim
40.012351,-82.458155,350006,COUGHLIN NISSAN EXTERIOR FRONT,Heath,OH,"Hebron Road Southeast, Heath, Licking County, Ohio, United States",Heath,Ohio,,2025-10-14T15:39:21.726558,Nominatim
40.012434,-82.458112,350010,COUGHLIN NISSAN EXTERIOR SOUTH,Heath,OH,"Hebron Road Southeast, Heath, Licking County, Ohio, United States",Heath,Ohio,,2025-10-14T15:39:23.216399,Nominatim
