latitude,longitude,station_id,station_name,original_city,original_state,street_address,city,state,zip_code,geocoded_at,geocoding_source
39.100284,-84.507156,245451,Queen City Square Garage - Tesla Destination,Cincinnati,OH,"Great American Insurance Tower, East 4th Street, Lytle Park Historic District, Central Business District, Cincinnati, Hamilton County, Ohio, 45202, United States",Cincinnati,Ohio,45202,2025-10-14T15:22:12.395660,Nominatim
39.100493,-84.512453,245453,Fountain Square South Garage,Cincinnati,OH,"The Westin Cincinnati, Honing Alley, Main Street Historic District, Central Business District, Cincinnati, Hamilton County, Ohio, 45202, United States",Cincinnati,Ohio,45202,2025-10-14T15:22:13.914617,Nominatim
39.101037,-84.514744,245455,84.51 Parking Garage,Cincinnati,OH,"Thorp Alley, West Fourth Street Historic District, Central Business District, Cincinnati, Hamilton County, Ohio, 45202, United States",Cincinnati,Ohio,45202,2025-10-14T15:22:15.314619,Nominatim
39.101435,-84.513862,245457,Fountain Place EV,Cincinnati,OH,"Huntington Center, 525, Vine Street, Main Street Historic District, Central Business District, Cincinnati, Hamilton County, Ohio, 45202, United States",Cincinnati,Ohio,45202,2025-10-14T15:22:16.873371,Nominatim
39.110929,-84.509811,245465,3CDC 3CDC ZIEGLER 4,Cincinnati,OH,"Ziegler Park Garage, Sycamore Street, Main Street Business District, Pendleton, Cincinnati, Hamilton County, Ohio, 45202, United States",Cincinnati,Ohio,45202,2025-10-14T15:22:18.402823,Nominatim
39.139973,-84.52195,245475,TRIHEALTH GSH2,Cincinnati,OH,"Good Samaritan Hospital, 375, Dixmyth Avenue, University Heights, Cincinnati, Hamilton County, Ohio, 45220, United States",Cincinnati,Ohio,45220,2025-10-14T15:22:19.944446,Nominatim
39.141143,-84.507693,245478,Cincinnati Zoo Expansion,Cincinnati,OH,"Cincinnati Zoo and Botanical Garden, Beldare Avenue, Avondale, Cincinnati, Hamilton County, Ohio, 45220, United States",Cincinnati,Ohio,45220,2025-10-14T15:22:21.407280,Nominatim
39.201233,-84.37054,245517,8044 EAST SIDE,Cincinnati,OH,"HORAN, 8044, Montgomery Road, Cincinnati, Sycamore Township, Hamilton County, Ohio, 45236, United States",Cincinnati,Ohio,45236,2025-10-14T15:22:22.957054,Nominatim
39.235406,-84.591648,245531,McCluskey Automotive,Cincinnati,OH,"Colerain Ave & Poole Rd, Colerain Avenue, Colerain Heights, Colerain Township, Hamilton County, Ohio, 45251, United States",,Ohio,45251,2025-10-14T15:22:24.338455,Nominatim
39.25713,-84.453626,245538,Hartco,Cincinnati,OH,"1236, Glendale Milford Road, Woodlawn, Hamilton County, Ohio, 45215, United States",Woodlawn,Ohio,45215,2025-10-14T15:22:25.904349,Nominatim
39.270393,-84.373524,245542,Envision Cinemas Bar & Grille - Tesla Destination,Cincinnati,OH,"Envision 7 Bar and Grille, 4780, Cornell Road, Cornell Park, Hazelwood, Blue Ash, Hamilton County, Ohio, 45241, United States",Blue Ash,Ohio,45241,2025-10-14T15:22:27.293187,Nominatim
39.27275,-84.32953,245545,Harpers Station,Cincinnati,OH,"11309, Montgomery Road, Harper’s Station, Sixteen Mile Stand, Symmes Township, Hamilton County, Ohio, 45269, United States",,Ohio,45269,2025-10-14T15:22:28.809617,Nominatim
39.274905,-81.591998,245547,Civitan Park,Belpre,OH,"Civitan Park, Belpre, Washington County, Ohio, 45714, United States",Belpre,Ohio,45714,2025-10-14T15:22:30.144696,Nominatim
39.280334,-84.443458,245557,City of Sharonville,Cincinnati,OH,"Delta Hotels by Marriott Cincinnati Sharonville, 11320, Chester Road, Northern Lights District, Cincinnati, Hamilton County, Ohio, 45246, United States",Cincinnati,Ohio,45246,2025-10-14T15:22:31.694538,Nominatim
39.287105,-84.46881,245570,Jake Sweeney Chevrolet,Cincinnati,OH,"Jake Sweeney Chevrolet, 33, West Kemper Road, Cincinnati, Hamilton County, Ohio, 45246, United States",Cincinnati,Ohio,45246,2025-10-14T15:22:33.029852,Nominatim
39.321908,-82.103672,245604,Ohio University - Peden Stadium,Athens,OH,"Hockhocking Adena Bikeway, Athens, Athens Township, Athens County, Ohio, 45701, United States",Athens,Ohio,45701,2025-10-14T15:22:34.579237,Nominatim
39.324106,-82.104548,245605,Ohio University - Lot 111,Athens,OH,"Ohio University, Circle Drive, Athens, Athens Township, Athens County, Ohio, 45701, United States",Athens,Ohio,45701,2025-10-14T15:22:35.922767,Nominatim
39.612791,-84.162069,245695,100 WEST SV MUNI STATION 1,Centerville,OH,"Centerville Municipal Offices, 100, West Spring Valley Road, Centerville, Washington Township, Montgomery County, Ohio, 45458, United States",Centerville,Ohio,45458,2025-10-14T15:22:37.433360,Nominatim
39.620549,-83.599853,245697,Destination Outlets Jeffersonville OH,Jeffersonville,OH,"Destination Outlets, Fayette County, Ohio, 43128, United States",,Ohio,43128,2025-10-14T15:22:38.751325,Nominatim
39.627184,-84.172624,245702,HUNTINGTON STATION 1,Dayton,OH,"Tillotson Place, Washington Township, Montgomery County, Ohio, 45458, United States",,Ohio,45458,2025-10-14T15:22:40.210253,Nominatim
39.685556,-84.104038,245731,Walden Village,Beavercreek,OH,"Walden Way, Kettering, Greene County, Ohio, 45440, United States",Kettering,Ohio,45440,2025-10-14T15:22:41.506182,Nominatim
39.707214,-84.133825,245740,Singer Vaughn Services,Kettering,OH,"2673, Culver Avenue, Kettering, Montgomery County, Ohio, 45429, United States",Kettering,Ohio,45429,2025-10-14T15:22:43.080451,Nominatim
39.708475,-84.169863,245742,ORCHARD DR ORCHARD LOT,Dayton,OH,"Orchard Drive, Shops of Oakwood, Oakwood, Montgomery County, Ohio, 45419, United States",Oakwood,Ohio,45419,2025-10-14T15:22:44.372393,Nominatim
39.723462,-84.161073,245753,JT Salon,Dayton,OH,"Little Giant Auto Body Paint & Repair, 400, Littell Avenue, Dayton, Montgomery County, Ohio, 45419, United States",Dayton,Ohio,45419,2025-10-14T15:22:45.934518,Nominatim
39.732437,-84.208885,245755,BookFactory,Dayton,OH,"Love's Travel Stop, South Edwin C. Moses Boulevard, Patterson, Dayton, Montgomery County, Ohio, 45408, United States",Dayton,Ohio,45408,2025-10-14T15:22:47.284696,Nominatim
39.7598,-84.194728,245824,CH GARAGE CH GARAGE 1,Dayton,OH,"City of Dayton Municipal Parking Garage, West 3rd Street, Dayton Terra-Cotta Historic District, Dayton, Montgomery County, Ohio, 45417, United States",Dayton,Ohio,45417,2025-10-14T15:22:48.821447,Nominatim
39.764121,-84.187724,245827,CH GARAGE STADIUM TWO,Dayton,OH,"North Patterson Boulevard, East Second Street Historic District, Riverdale, Dayton, Montgomery County, Ohio, 45402, United States",Dayton,Ohio,45402,2025-10-14T15:22:50.182460,Nominatim
39.77331,-84.0804,245836,Beavercreek Office Suites,Beavercreek,OH,"PreTalen, 4027, Colonel Glenn Highway, New Germany, Dayton, Beavercreek, Greene County, Ohio, 45431, United States",Dayton,Ohio,45431,2025-10-14T15:22:51.734056,Nominatim
39.809986,-84.188364,245841,Les' Tree Service,Dayton,OH,"Knox Auto Services, Coronette Avenue, Dayton, Montgomery County, Ohio, 45414, United States",Dayton,Ohio,45414,2025-10-14T15:22:53.165820,Nominatim
39.824672,-84.028263,245846,Flying Pig Tavern,Fairborn,OH,"678, Cedar Drive, Fairborn, Greene County, Ohio, 45324, United States",Fairborn,Ohio,45324,2025-10-14T15:22:54.667771,Nominatim
39.828644,-84.198684,245847,Maggies Place,Dayton,OH,"1990, Bartley Road, Dayton, Montgomery County, Ohio, 45414, United States",Dayton,Ohio,45414,2025-10-14T15:22:56.092266,Nominatim
39.831673,-84.119614,245848,Amvets Post 464,Huber Heights,OH,"AMVETS Post 464, 5420, Brandt Pike, Huber Heights, Montgomery County, Ohio, 45424, United States",Huber Heights,Ohio,45424,2025-10-14T15:22:57.518698,Nominatim
39.84984,-84.198405,245850,American Legion Post 668,Dayton,OH,"8218, North Dixie Drive, Butler Township, Montgomery County, Ohio, 45414, United States",,Ohio,45414,2025-10-14T15:22:59.113378,Nominatim
39.850463,-84.187289,245851,BMW OF DAYTON STATION 1,Dayton,OH,"Evans Motorworks, Park Center Drive, North Dayton, Vandalia, Montgomery County, Ohio, 45414, United States",Vandalia,Ohio,45414,2025-10-14T15:23:00.689438,Nominatim
39.877253,-83.063448,245855,"Grove City, OH",Grove City,OH,"Tesla Supercharger, 2221, Stringtown Road, Grove City, Jackson Township, Franklin County, Ohio, 43123, United States",Grove City,Ohio,43123,2025-10-14T15:23:02.011232,Nominatim
39.878625,-83.06472,245857,COTA G.C. P&R UNIT 1,Grove City,OH,"Grove City Park & Ride, 2321, Stringtown Road, Grove City, Jackson Township, Franklin County, Ohio, 43123, United States",Grove City,Ohio,43123,2025-10-14T15:23:03.441310,Nominatim
39.882378,-83.095168,245859,BROADWAYSTATION BROADWAY 1,Grove City,OH,"3455, Grove City Road, Grove City, Jackson Township, Franklin County, Ohio, 43123, United States",Grove City,Ohio,43123,2025-10-14T15:23:04.757598,Nominatim
39.937262,-82.005663,245890,Dutro Nissan and Ford,Zanesville,OH,"Dutro Auto, 132, South 5th Street, Zanesville, Muskingum County, Ohio, 43701, United States",Zanesville,Ohio,43701,2025-10-14T15:23:06.443829,Nominatim
39.956039,-83.011169,245909,RIVER & RICH RIVER & RICH 1,Columbus,OH,"427, West Rich Street, Franklinton, Columbus, Franklin County, Ohio, 43215, United States",Columbus,Ohio,43215,2025-10-14T15:23:08.025491,Nominatim
39.958675,-84.18528,245913,Tipp City - Government Center,Tipp City,OH,"Tipp Government Center, South Garber Drive, Tipp City, Miami County, Ohio, 45371, United States",Tipp City,Ohio,45371,2025-10-14T15:23:09.591130,Nominatim
39.960215,-82.996722,245915,BRICKER&ECKLER EV STATION,Columbus,OH,"111, South Lazelle Street, Downtown, Columbus, Franklin County, Ohio, 43215, United States",Columbus,Ohio,43215,2025-10-14T15:23:11.062351,Nominatim
39.96421,-82.998407,245918,Columbus Lawyer - Gay Street,Columbus,OH,"East Elm Street, High Street Corridor, Columbus, Franklin County, Ohio, 43216, United States",Columbus,Ohio,43216,2025-10-14T15:23:12.562417,Nominatim
39.96703,-82.999197,245920,INDUS HOTEL CANOPY VALET,Columbus,OH,"East Hickory Street, Warehouse District, Columbus, Franklin County, Ohio, 43216, United States",Columbus,Ohio,43216,2025-10-14T15:23:13.906915,Nominatim
39.973909,-83.026458,245923,Southern Station,Columbus,OH,"Swan Street, Grandview Yard, Grandview Heights, Franklin County, Ohio, 43212, United States",Grandview Heights,Ohio,43212,2025-10-14T15:23:15.841498,Nominatim
39.974488,-83.004333,245924,W Poplar Ave Parking,Columbus,OH,"48, West Poplar Avenue, Victorian Village, Columbus, Franklin County, Ohio, 43215, United States",Columbus,Ohio,43215,2025-10-14T15:23:17.355381,Nominatim
39.977535,-83.002987,245927,LINCOLN GARAGE HIGH STREET 1,Columbus,OH,"North Pearl Street, Italian Village, Columbus, Franklin County, Ohio, 43215, United States",Columbus,Ohio,43215,2025-10-14T15:23:18.923031,Nominatim
39.980032,-83.028202,245929,LAZ COLUMBUS OH BOBCAT AVE 1,Grandview Heights,OH,"Dorchester Way, Grandview Yard, Grandview Heights, Franklin County, Ohio, 43212, United States",Grandview Heights,Ohio,43212,2025-10-14T15:23:20.195074,Nominatim
39.987586,-83.045501,245932,BROADVIEW THE BROADVIEW2,Columbus,OH,"Halwani Cuisine, 1453, Ida Avenue, Fifth by Northwest, Columbus, Franklin County, Ohio, 43212, United States",Columbus,Ohio,43212,2025-10-14T15:23:21.794664,Nominatim
39.992176,-83.019745,245936,OHIO STATE UNV NEWOLDCANNON1,Columbus,OH,"Old Cannon Garage, Medical Center Drive, NECKO, University District District 4, Columbus, Franklin County, Ohio, 43210, United States",Columbus,Ohio,43210,2025-10-14T15:23:23.114594,Nominatim
39.994115,-83.006916,245937,LAZ Parking Columbus - Tesla Destination,Columbus,OH,"1567, North High Street, Weinland Park, Columbus, Franklin County, Ohio, 43201, United States",Columbus,Ohio,43201,2025-10-14T15:23:24.860650,Nominatim
39.997311,-82.931824,245938,Columbus Airport Mariott,Columbus,OH,"Columbus Airport Marriott, Demonye Drive, Columbus, Sharon, Franklin County, Ohio, 43129, United States",Columbus,Ohio,43129,2025-10-14T15:23:26.184695,Nominatim
39.997928,-82.887453,245939,CMH AIRPORT EV GARAGEEV#1,Columbus,OH,"Post-Security Concourse, East Columbus, Columbus, Sharon, Franklin County, Ohio, 43213, United States",Columbus,Ohio,43213,2025-10-14T15:23:27.827173,Nominatim
39.997977,-83.032977,245940,OHIO STATE UNV CAR2,Columbus,OH,"Center for Automotive Research, 930, Kinnear Road, University View, Columbus, Clinton Township, Franklin County, Ohio, 43212, United States",Columbus,Ohio,43212,2025-10-14T15:23:29.271335,Nominatim
39.997992,-82.887597,245941,CMH AIRPORT EV GARAGEEV#4,Columbus,OH,"Post-Security Concourse, East Columbus, Columbus, Sharon, Franklin County, Ohio, 43213, United States",Columbus,Ohio,43213,2025-10-14T15:23:30.826539,Nominatim
39.998066,-82.887404,245942,CMH AIRPORT EV GARAGEEV#5,Columbus,OH,"Post-Security Concourse, East Columbus, Columbus, Sharon, Franklin County, Ohio, 43213, United States",Columbus,Ohio,43213,2025-10-14T15:23:32.125748,Nominatim
40.00584,-83.016042,245946,OHIO STATE UNV LANE AVE GARAGE,Columbus,OH,"Lane Avenue Parking Garage, 2105, Neil Avenue, University District District 2, Columbus, Sharon, Franklin County, Ohio, 43210, United States",Columbus,Ohio,43210,2025-10-14T15:23:33.825960,Nominatim
40.006276,-83.052762,245947,Whole Foods Market,Upper Arlington,OH,"Berkshire Road, The University, Upper Arlington, Sharon, Franklin County, Ohio, 43221, United States",Upper Arlington,Ohio,43221,2025-10-14T15:23:35.211113,Nominatim
40.020173,-82.877855,245963,Muni Lot 3,Gahanna,OH,"Latta Alley, Gahanna, Mifflin Township, Franklin County, Ohio, 43239, United States",Gahanna,Ohio,43239,2025-10-14T15:23:36.732758,Nominatim
40.023361,-83.026658,245966,JAP GURU NORTH STATION,Columbus,OH,"Stinchcomb Drive, Riverview, Columbus, Sharon, Franklin County, Ohio, 43202, United States",Columbus,Ohio,43202,2025-10-14T15:23:38.066381,Nominatim
40.03176,-83.12544,245973,Buckeye Nissan,Hilliard,OH,"Buckeye Nissan, Parkway Lane, Hilliard, Norwich Township, Franklin County, Ohio, 43026, United States",Hilliard,Ohio,43026,2025-10-14T15:23:39.551967,Nominatim
40.033075,-83.032372,245975,RMH PURPLE BING 1,COLUMBUS,OH,"Purple Garage, Olentangy River Road, Olentangy West, Columbus, Sharon, Franklin County, Ohio, 43214, United States",Columbus,Ohio,43214,2025-10-14T15:23:40.848918,Nominatim
40.047485,-82.45157,245984,LMH STATION 1,Newark,OH,"Licking Memorial Hospital, 1320, West Main Street, Newark, Licking County, Ohio, 43055, United States",Newark,Ohio,43055,2025-10-14T15:23:42.398526,Nominatim
40.050521,-82.912239,245986,Hilton Columbus at Easton - Tesla Destination,Columbus,OH,"Hilton Garage, Chagrin Drive, Easton, Columbus, Sharon, Franklin County, Ohio, 43230, United States",Columbus,Ohio,43230,2025-10-14T15:23:43.742832,Nominatim
40.050915,-82.914218,245988,EASTON EAST GARAGE 1,Columbus,OH,"East Covered Parking Garage, Chagrin Drive, Easton, Columbus, Sharon, Franklin County, Ohio, 43230, United States",Columbus,Ohio,43230,2025-10-14T15:23:45.260849,Nominatim
40.051873,-82.913971,245991,EASTON CPE250 FENLON 1,Columbus,OH,"Easton Town Center, The Strand, Easton, Columbus, Sharon, Franklin County, Ohio, 43230, United States",Columbus,Ohio,43230,2025-10-14T15:23:46.555184,Nominatim
40.089892,-82.998954,246015,DLZ Corp.,Worthington,OH,"6111, Huntley Road, Worthington, Sharon Township, Franklin County, Ohio, 43229, United States",Worthington,Ohio,43229,2025-10-14T15:23:48.177723,Nominatim
40.091405,-83.093012,246017,58 - Sawmill Rd,Dublin,OH,"Sawmill Road, Columbus, Franklin County, Ohio, 43017, United States",Columbus,Ohio,43017,2025-10-14T15:23:49.638734,Nominatim
40.099725,-83.146095,246020,JLR DUBLIN DC FAST 01,Dublin,OH,"US 33;SR 161, Dublin, Washington Township, Franklin County, Ohio, 43016, United States",Dublin,Ohio,43016,2025-10-14T15:23:51.173845,Nominatim
40.09979,-83.149812,246021,MAG DUBLIN VOLVO LOT RIGHT,Dublin,OH,"MAG Volkswagen of Dublin, Venture Drive, Dublin, Washington Township, Franklin County, Ohio, 43016, United States",Dublin,Ohio,43016,2025-10-14T15:23:52.500034,Nominatim
40.100136,-83.115442,246022,DUBLIN FLEET DARBY LOT #1,Dublin,OH,"North Street, Historic Dublin, Dublin, Washington Township, Franklin County, Ohio, 43017, United States",Dublin,Ohio,43017,2025-10-14T15:23:54.039687,Nominatim
40.100939,-83.155399,246023,MERCEDES DRIVE MERCEDES DRIVE,Dublin,OH,"Mercedes Drive, Dublin, Washington Township, Franklin County, Ohio, 43016, United States",Dublin,Ohio,43016,2025-10-14T15:23:55.346833,Nominatim
40.135104,-82.948027,246032,WESTERVILLE SPORTS COM 1,Westerville,OH,"Sports Complex, Westerville, Delaware County, Ohio, 43240, United States",Westerville,Ohio,43240,2025-10-14T15:23:56.797108,Nominatim
40.14069,-83.01614,246034,Columbus Mitsubishi North,Columbus,OH,"Mirada Drive South, Columbus, Orange Township, Delaware County, Ohio, 43240, United States",Columbus,Ohio,43240,2025-10-14T15:23:58.158930,Nominatim
40.140935,-82.996183,246035,JPM CHASE STATION 5,Columbus,OH,"JP Morgan Chase McCoy Center, 1111, Polaris Parkway, Columbus, Delaware County, Ohio, 43240, United States",Columbus,Ohio,43240,2025-10-14T15:23:59.661405,Nominatim
40.141109,-82.998118,246036,JPM CHASE STATION 1,Columbus,OH,"The McCoy Center - JPMorgan Chase, Gemini Parkway, Columbus, Delaware County, Ohio, 43240, United States",Columbus,Ohio,43240,2025-10-14T15:24:00.940158,Nominatim
40.146027,-82.97316,246038,POINTE POLARIS STATION 1,Columbus,OH,"Lyra Drive, Columbus, Delaware County, Ohio, 43240, United States",Columbus,Ohio,43240,2025-10-14T15:24:02.432011,Nominatim
40.147054,-82.97363,246041,POINTE@POLARIS EV STATION 01,Columbus,OH,"Gemini Place, Columbus, Delaware County, Ohio, 43240, United States",Columbus,Ohio,43240,2025-10-14T15:24:03.739997,Nominatim
40.149678,-82.966796,246042,IKEA USA COLUMBUS 2,Columbus,OH,"Ikea Way, Columbus, Delaware County, Ohio, 43240, United States",Columbus,Ohio,43240,2025-10-14T15:24:05.311441,Nominatim
40.151569,-82.975092,246043,BAYWOOD HOTELS STATION 2,Columbus,OH,"Lyra Drive, Columbus, Delaware County, Ohio, 43240, United States",Columbus,Ohio,43240,2025-10-14T15:24:06.659152,Nominatim
40.15795,-83.07893,246046,CHAMPION POWELL CROSSING,Powell,OH,"West Olentangy Street, Powell, Liberty Township, Delaware County, Ohio, 43065, United States",Powell,Ohio,43065,2025-10-14T15:24:08.200943,Nominatim
40.158196,-83.017804,246047,3503 Polaris OH,Lewis Center,OH,"Discount Tire, 190, Hornbeam Lane, Powell Center, Orange Township, Delaware County, Ohio, 43035, United States",,Ohio,43035,2025-10-14T15:24:09.553352,Nominatim
40.232995,-83.353963,246073,Woodside,Marysville,OH,"The Residences at Woodside, 291, Pearlash Road, The Residences at Woodside, Marysville, Union County, Ohio, 43044, United States",Marysville,Ohio,43044,2025-10-14T15:24:11.114159,Nominatim
40.377481,-82.397651,246112,UPTOWN GAMBIER GAMBIER 1,Gambier,OH,"Kenyon College, Middle Path, Gambier, College Township, Knox County, Ohio, 43022, United States",Gambier,Ohio,43022,2025-10-14T15:24:12.406335,Nominatim
40.764683,-83.826793,246378,ONU INN,Ada,OH,"525, South Main Street, Ada, Liberty Township, Hardin County, Ohio, 45810, United States",Ada,Ohio,45810,2025-10-14T15:24:13.914327,Nominatim
40.798559,-81.941382,246452,CITY OF WOOSTER MERCH BLOCK 1,Wooster,OH,"Walnut Street Gallery, 148, North Walnut Street, Wooster Public Square Historic District, Wooster, Wayne County, Ohio, 44691, United States",Wooster,Ohio,44691,2025-10-14T15:24:15.268785,Nominatim
40.798678,-81.939838,246453,CITY OF WOOSTER NE QUAD 1,Wooster,OH,"North Market Street, Wooster Public Square Historic District, Wooster, Wayne County, Ohio, 44691, United States",Wooster,Ohio,44691,2025-10-14T15:24:16.750575,Nominatim
41.082616,-81.51904,246553,Cascade Parking Deck,Akron,OH,"1 Cascade Plaza, Downtown Akron, Canal District, Downtown, Akron, Summit County, Ohio, 44308, United States",Akron,Ohio,44308,2025-10-14T15:24:18.395520,Nominatim
41.109884,-83.211489,246562,COPPUS MOTORS 1 COPPUS MOTORS,Tiffin,OH,"ALDI, 2124, West Market Street, Tiffin, Hopewell Township, Seneca County, Ohio, 44883, United States",Tiffin,Ohio,44883,2025-10-14T15:24:19.951311,Nominatim
41.147006,-81.335378,246576,Harbourt Hall Parking Lot,Kent,OH,"Kent State University, Haymaker Parkway, Gateway, Kent, Portage County, Ohio, 44242, United States",Kent,Ohio,44242,2025-10-14T15:24:21.405678,Nominatim
41.150817,-81.3523,246578,KENT STATE R9 IAB,Kent,OH,"East Summit Street, Gateway, Kent, Portage County, Ohio, 44240, United States",Kent,Ohio,44240,2025-10-14T15:24:23.017268,Nominatim
41.247475,-81.364681,246600,Volkswagen of Streetsboro,Streetsboro,OH,"Classic Dr, Streetsboro, Portage County, Ohio, 44241, United States",Streetsboro,Ohio,44241,2025-10-14T15:24:24.282415,Nominatim
41.285047,-82.216184,246612,George A Abram Pavillion,Oberlin,OH,"58, Edison Street, Oberlin, Lorain County, Ohio, 44074, United States",Oberlin,Ohio,44074,2025-10-14T15:24:25.878906,Nominatim
41.289262,-82.217212,246613,Oberlin City Hall,Oberlin,OH,"85, South Main Street, Oberlin, New Russia Township, Lorain County, Ohio, 44074, United States",Oberlin,Ohio,44074,2025-10-14T15:24:27.247415,Nominatim
41.3133,-81.344086,246633,AURORA LIBRARY EAST CHARGERS,Aurora,OH,"Aurora Memorial Library & Community Theater, 115, East Pioneer Trail, Beljon Farms, Aurora, Portage County, Ohio, 44202, United States",Aurora,Ohio,44202,2025-10-14T15:24:28.817555,Nominatim
41.313663,-81.517018,246634,Macedonia Commons - Tesla Supercharger,Macedonia,OH,"Tesla Supercharger, 8210, Macedonia Commons Boulevard, Macedonia Commons, Macedonia, Summit County, Ohio, 44056, United States",Macedonia,Ohio,44056,2025-10-14T15:24:30.117506,Nominatim
41.373994,-83.649364,246645,City of Bowling Green - Parking Lot 2,Bowling Green,OH,"Public Parking Lot 2, Clough Street, Downtown, Bowling Green, Wood County, Ohio, 43402, United States",Bowling Green,Ohio,43402,2025-10-14T15:24:32.797175,Nominatim
41.402746,-81.552724,246649,Bedford Nissan,Bedford,OH,"Broadway Avenue, Bedford, Cuyahoga County, Ohio, 44146, United States",Bedford,Ohio,44146,2025-10-14T15:24:34.109523,Nominatim
41.403107,-81.55094,246650,MOTORCARS VOLVO CT4023-01,Bedford,OH,"18114, Rockside Road, Bedford, Cuyahoga County, Ohio, 44146, United States",Bedford,Ohio,44146,2025-10-14T15:24:35.638623,Nominatim
41.406139,-81.550848,246651,Hyundai of Bedford,Bedford,OH,"118, Greencroft Road, Bedford, Cuyahoga County, Ohio, 44146, United States",Bedford,Ohio,44146,2025-10-14T15:24:37.089865,Nominatim
41.409652,-81.938059,246653,Nissan of North Olmsted,North Olmsted,OH,"Berkshire Drive, North Olmsted, Cuyahoga County, Ohio, 44070, United States",North Olmsted,Ohio,44070,2025-10-14T15:24:38.567925,Nominatim
41.418728,-81.51523,246656,SOUTH EAST H-D DC FAST HOG,Bedford Heights,OH,"Aurora Road, Bedford Heights, Cuyahoga County, Ohio, 44139, United States",Bedford Heights,Ohio,44139,2025-10-14T15:24:39.841838,Nominatim
41.419384,-81.79034,246657,WESTSIDEMZ SERVICE,Cleveland,OH,"Classic Mazda Westside, Brookpark Road, Brook Park, Cuyahoga County, Ohio, 44070, United States",Brook Park,Ohio,44070,2025-10-14T15:24:41.282088,Nominatim
41.467061,-81.536863,246664,The Van Aken District Parking Garage,Shaker Heights,OH,"Bowser Alley, Van Aken District, Shaker Heights, Cuyahoga County, Ohio, 44128, United States",Shaker Heights,Ohio,44128,2025-10-14T15:24:42.748958,Nominatim
41.468245,-81.565281,246665,City Hall Annex,Shaker Heights,OH,"Lee Road, Chagrin-Lee, Shaker Heights, Cuyahoga County, Ohio, 44137, United States",Shaker Heights,Ohio,44137,2025-10-14T15:24:44.453526,Nominatim
41.479196,-81.839972,246666,WFM MIDATLANTIC WFM-RRO1,Rocky River,OH,"Dero, Detroit Road, Rocky River, Cuyahoga County, Ohio, 44145, United States",Rocky River,Ohio,44145,2025-10-14T15:24:45.763780,Nominatim
41.489883,-81.710265,246669,CHURCH+STATE CS GW 1,Cleveland,OH,"Church Avenue, Hingetown, Ohio City, Cleveland, Cuyahoga County, Ohio, 44113, United States",Cleveland,Ohio,44113,2025-10-14T15:24:47.232350,Nominatim
41.49062,-83.36665,246670,Blue Heron Service Plaza Wesbound - Tesla Supercharger,Genoa,OH,"Blue Heron Service Area, Ohio Turnpike, Clay Township, Sandusky County, Ohio, 43430, United States",,Ohio,43430,2025-10-14T15:24:48.535965,Nominatim
41.49838,-81.695874,246672,Terminal Tower Parking Garage,Cleveland,OH,"West Superior Avenue, Downtown Cleveland, Cleveland, Cuyahoga County, Ohio, 44113, United States",Cleveland,Ohio,44113,2025-10-14T15:24:50.040981,Nominatim
41.499867,-81.683532,246673,1212 Huron Rd,Cleveland,OH,"The Halle Garage, 1212, Huron Road East, Downtown Cleveland, Cleveland, Cuyahoga County, Ohio, 44115, United States",Cleveland,Ohio,44115,2025-10-14T15:24:51.357460,Nominatim
41.507086,-81.604661,246677,Case Western Reserve University Hospital - Cornell Garage,Cleveland,OH,"University Hospitals Cleveland Medical Center, 11100, Euclid Avenue, Uptown, Cleveland, Cuyahoga County, Ohio, 44106, United States",Cleveland,Ohio,44106,2025-10-14T15:24:52.935673,Nominatim
41.591415,-83.566689,246697,IBEW & NECA Electrical Industry Building,Rossford,OH,"773, Lime City Road, Rossford, Wood County, Ohio, 43460, United States",Rossford,Ohio,43460,2025-10-14T15:24:54.298346,Nominatim
41.675499,-81.309971,246730,MEIJER STORES 309 MENTOR 1,Mentor,OH,"9200, Mentor Avenue, East Mentor, Mentor, Lake County, Ohio, 44060, United States",Mentor,Ohio,44060,2025-10-14T15:24:55.758561,Nominatim
41.682364,-81.33769,246735,CLASSIC HYUNDAI WEST SIDE,Mentor,OH,"Classic Hyundai, 8460, Tyler Boulevard, Mentor, Lake County, Ohio, 44060, United States",Mentor,Ohio,44060,2025-10-14T15:24:58.276572,Nominatim
41.683526,-81.338059,246737,Classic Volkswagen,Mentor,OH,"Classic Volkswagen, 8465, Tyler Boulevard, Mentor, Lake County, Ohio, 44060, United States",Mentor,Ohio,44060,2025-10-14T15:24:59.726177,Nominatim
41.686142,-81.334344,246738,WRHD CHARGE WR HARLEY,Mentor,OH,"Western Reserve Harley-Davidson, Tyler Boulevard, Mentor, Lake County, Ohio, 44060, United States",Mentor,Ohio,44060,2025-10-14T15:25:01.119673,Nominatim
