latitude,longitude,station_id,station_name,original_city,original_state,street_address,city,state,zip_code,geocoded_at,geocoding_source
39.202287,-83.611587,224789,COLONY PARK STATION EAST,Hillsboro,OH,"100, North High Street, Hillsboro Historic Business District, Hillsboro, Highland County, Ohio, 45133, United States",Hillsboro,Ohio,45133,2025-10-14T15:11:04.126368,Nominatim
39.202827,-83.610557,224790,COLONY PARK STATION WEST,Hillsboro,OH,"128, North High Street, Hillsboro Historic Business District, Hillsboro, Highland County, Ohio, 45133, United States",Hillsboro,Ohio,45133,2025-10-14T15:11:05.427875,Nominatim
39.203441,-84.380355,224794,Aspire Kenwood,Cincinnati,OH,"Kenwood Road, Holiday Acres, Kenwood, Sycamore Township, Hamilton County, Ohio, 45242, United States",Kenwood,Ohio,45242,2025-10-14T15:11:07.075237,Nominatim
39.21427,-84.359899,224809,M-B HUDSON GUEST CHARGING,Cincinnati,OH,"Mercedes-Benz of Cincinnati, Montgomery Road, Wellington Glen, Kenwood, Sycamore Township, Hamilton County, Ohio, 45242, United States",Kenwood,Ohio,45242,2025-10-14T15:11:08.834504,Nominatim
39.217678,-84.542267,224817,North College Hill Admin Bldg - Phase 1,Cincinnati,OH,"1526, West Galbraith Road, North College Hill, Hamilton County, Ohio, 45247, United States",North College Hill,Ohio,45247,2025-10-14T15:11:10.540864,Nominatim
39.223792,-84.35565,224822,Montgomery QTR Garage Block – Southern Building,Montgomery,OH,"Ayers Place, Montgomery, Hamilton County, Ohio, 45242, United States",Montgomery,Ohio,45242,2025-10-14T15:11:12.076714,Nominatim
39.22762,-84.355871,224826,City of Montgomery - Shelly Ln Public Parking Lot,Montgomery,OH,"Shelly Lane, Montgomery, Hamilton County, Ohio, 45242, United States",Montgomery,Ohio,45242,2025-10-14T15:11:13.596676,Nominatim
39.228634,-84.374796,224828,49 Hundred Apartments,Blue Ash,OH,"Hunt Road, 49Hundred, Blue Ash, Hamilton County, Ohio, 45242, United States",Blue Ash,Ohio,45242,2025-10-14T15:11:15.061986,Nominatim
39.232068,-84.507211,224829,Springfield Twp Admin Building Parking Lot,Cincinnati,OH,"9310, Sheralee Lane, Compton Park, Springfield Township, Hamilton County, Ohio, 54218, United States",,Ohio,54218,2025-10-14T15:11:16.795107,Nominatim
39.239694,-84.350623,224835,Montgomery City Hall,Montgomery,OH,"7985, School House Lane, Montgomery Square, Montgomery Heights, Montgomery, Hamilton County, Ohio, 45242, United States",Montgomery,Ohio,45242,2025-10-14T15:11:18.309778,Nominatim
39.245144,-84.469324,224841,REC CENTER REC CENTER,Cincinnati,OH,"Wyoming Family Recreation and Aquatic Center, McLean Avenue, Woodlawn, Hamilton County, Ohio, 45215, United States",Woodlawn,Ohio,45215,2025-10-14T15:11:19.870100,Nominatim
39.245848,-84.610506,224843,Colerain Township Building,Colerain Township,OH,"Colerain Township Administration Building, 4200, Springdale Road, Dornbusch, Colerain Township, Hamilton County, Ohio, 45247, United States",,Ohio,45247,2025-10-14T15:11:21.328068,Nominatim
39.248064,-84.346678,224847,Church of the Saviour United Methodist,Cincinnati,OH,"Pfeiffer Road, Montgomery, Hamilton County, Ohio, 45242, United States",Montgomery,Ohio,45242,2025-10-14T15:11:22.809837,Nominatim
39.249515,-84.790463,224850,Kroger 907 Harrison OH,Harrison,OH,"Kroger Marketplace, 10477, Harrison Avenue, Harrison, Harrison Township, Hamilton County, Ohio, 45030, United States",Harrison,Ohio,45030,2025-10-14T15:11:24.219765,Nominatim
39.25149,-84.42028,224854,TRIHEALTH EVENDALE,Cincinnati,OH,"Trihealth Good Samaritan Hospital At Evendale, 3155, Glendale Milford Road, Village Crossing Shopping Center, Cincinnati, Hamilton County, Ohio, 45241, United States",Cincinnati,Ohio,45241,2025-10-14T15:11:25.788283,Nominatim
39.251984,-84.341896,224855,TRIHEALTH BNH,Montgomery,OH,"Bethesda North Hospital, 10500, Montgomery Road, Mayfair of Montgomery, Cincinnati, Hamilton County, Ohio, 45242, United States",Cincinnati,Ohio,45242,2025-10-14T15:11:27.467278,Nominatim
39.25564,-84.429736,224857,Brendamour Evendale Business Center,Cincinnati,OH,"10450, Medallion Drive, Evendale, Hamilton County, Ohio, 45215, United States",Evendale,Ohio,45215,2025-10-14T15:11:28.918181,Nominatim
39.25686,-84.4185,224858,Village of Evendale,Cincinnati,OH,"10498, Kingsport Drive, Park Hills, Evendale, Hamilton County, Ohio, 45241, United States",Evendale,Ohio,45241,2025-10-14T15:11:30.242753,Nominatim
39.265658,-84.331557,224865,Vintage Club Garage,Montgomery,OH,"The Christ Hospital Outpatient Center Montgomery, Vintage Club Drive, Montgomery, Hamilton County, Ohio, 45269, United States",Montgomery,Ohio,45269,2025-10-14T15:11:31.716077,Nominatim
39.266344,-84.259657,224866,City of Loveland,Loveland,OH,"Linda J. Cox Trailside Parking Lot, River Road;Anschutz Avenue;Crutchfield Place, Loveland, Clermont County, Ohio, 45140, United States",Loveland,Ohio,45140,2025-10-14T15:11:33.230996,Nominatim
39.280017,-84.444889,224881,LivINN Hotels - 11385 Chester Rd,Sharonville,OH,"LivINN Cincinnati / Sharonville Convention Center, Chester Road, Northern Lights District, Sharonville, Hamilton County, Ohio, 45246, United States",Sharonville,Ohio,45246,2025-10-14T15:11:34.748139,Nominatim
39.28784,-84.525154,224891,FOREST PARK EV STATION 1,Cincinnati,OH,"1201, West Kemper Road, Forest Park Square, Forest Park, Hamilton County, Ohio, 45252, United States",Forest Park,Ohio,45252,2025-10-14T15:11:36.126995,Nominatim
39.287916,-84.525148,224892,FOREST PARK EV STATION 2,Cincinnati,OH,"1201, West Kemper Road, Forest Park Square, Forest Park, Hamilton County, Ohio, 45252, United States",Forest Park,Ohio,45252,2025-10-14T15:11:37.566556,Nominatim
39.28864,-84.525457,224893,Forest Park EV Stations 1 and 2,Cincinnati,OH,"Winton Woods North Campus, 1231, West Kemper Road, Forest Park Square, Forest Park, Hamilton County, Ohio, 45240, United States",Forest Park,Ohio,45240,2025-10-14T15:11:38.934457,Nominatim
39.289753,-84.40588,224895,ECO ENGINEERING ECO#1,Cincinnati,OH,"11815, Highway Drive, Sharonville, Hamilton County, Ohio, 45241, United States",Sharonville,Ohio,45241,2025-10-14T15:11:40.438349,Nominatim
39.299,-84.319722,224904,Latitude - 5245 Natorp,Mason,OH,"Merten Drive, Deerfield Crossing, Deerfield Township, Warren County, Ohio, 45249, United States",,Ohio,45249,2025-10-14T15:11:41.839012,Nominatim
39.299806,-84.320139,224906,Latitude - 5265 Natorp,Mason,OH,"FLO, Natorp Boulevard, Deerfield Crossing, Deerfield Township, Warren County, Ohio, 45249, United States",,Ohio,45249,2025-10-14T15:11:43.340135,Nominatim
39.300935,-83.961015,224908,Kroger 395 Blanchester OH,Blanchester,OH,"Kroger Food & Drug, 1001, Cherry Street, Blanchester, Marion Township, Clinton County, Ohio, 45107, United States",Blanchester,Ohio,45107,2025-10-14T15:11:44.739834,Nominatim
39.301737,-84.306714,224909,Governor's Pointe Office Park,Mason,OH,"Queen City Hospice, 4605, Duke Drive, Governor’s Pointe Office Park, Mason, Deerfield Township, Warren County, Ohio, 45040, United States",Mason,Ohio,45040,2025-10-14T15:11:46.221140,Nominatim
39.304203,-84.525663,224915,Meijer Fairfield #159,Fairfield,OH,"Kolb Drive, Fairfield, Butler County, Ohio, 45240, United States",Fairfield,Ohio,45240,2025-10-14T15:11:47.575887,Nominatim
39.316541,-84.422462,224923,Savoy Streets of West Chester,West Chester,OH,"9485, River Walk Drive, West Chester Township, Butler County, Ohio, 45069, United States",,Ohio,45069,2025-10-14T15:11:49.103539,Nominatim
39.316033,-84.434478,224924,IKEA USA WEST CHESTER 1,West Chester,OH,"Allen Road, West Chester Township, Butler County, Ohio, 45069, United States",,Ohio,45069,2025-10-14T15:11:50.435335,Nominatim
39.319923,-84.429458,224930,M-B HUDSON MBWC GUEST CHG,West Chester Township,OH,"5897, Mulhauser Road, West Chester Township, Butler County, Ohio, 45069, United States",,Ohio,45069,2025-10-14T15:11:51.931880,Nominatim
39.325551,-82.107694,224935,Ohio University - Stocker Center Parking Lot,Athens,OH,"West Green Drive, Uptown, Athens, Athens Township, Athens County, Ohio, 45701, United States",Athens,Ohio,45701,2025-10-14T15:11:53.349540,Nominatim
39.32655,-84.42641,224936,Aloft Cincinnati West Chester - Tesla Destination,West Chester,OH,"Aloft, Centre Pointe Drive, West Chester Township, Butler County, Ohio, 45069, United States",,Ohio,45069,2025-10-14T15:11:54.881615,Nominatim
39.329065,-82.100433,224938,Athens City Parking Garage,Athens,OH,"East Washington Street, Uptown, Athens, Athens Township, Athens County, Ohio, 45701, United States",Athens,Ohio,45701,2025-10-14T15:11:56.325416,Nominatim
39.33311,-82.12961,224943,Little Fish Brewing Co,Athens,OH,"Armitage Road, Grosvenor, Athens, Athens Township, Athens County, Ohio, 45701, United States",Athens,Ohio,45701,2025-10-14T15:11:57.795247,Nominatim
39.334096,-84.563876,224945,Fairfield Community Arts Center,Fairfield,OH,"Fairfield Community Arts Center, 411, Wessel Drive, Symmes Corner, Fairfield, Butler County, Ohio, 45014, United States",Fairfield,Ohio,45014,2025-10-14T15:11:59.088038,Nominatim
39.33533,-84.43822,224946,KEMBA CU STATION2,West chester,OH,"5588, Chappel Crossing Boulevard, West Chester Township, Butler County, Ohio, 45069, United States",,Ohio,45069,2025-10-14T15:12:00.592984,Nominatim
39.335479,-84.520467,224947,Grant City of Fairfield,Fairfield,OH,"Jungle Jim’s International Market, Dixie Highway, Fairfield, Butler County, Ohio, 45014, United States",Fairfield,Ohio,45014,2025-10-14T15:12:01.942778,Nominatim
39.335648,-84.43876,224948,KEMBA CU STATION1,West Chester,OH,"5571, Chappel Crossing Boulevard, West Chester Township, Butler County, Ohio, 45069, United States",,Ohio,45069,2025-10-14T15:12:03.470346,Nominatim
39.336136,-82.981757,224949,YOCTANGEE YOCTANGEEPARK2,Chillicothe,OH,"33, East Water Street, Chillicothe, Ross County, Ohio, 45601, United States",Chillicothe,Ohio,45601,2025-10-14T15:12:04.897052,Nominatim
39.336472,-84.227917,224950,Alexander Pointe - Building 2,Maineville,OH,"Willow Pond Boulevard, Miami Bluffs, Hopkinsville, Hamilton Township, Warren County, Ohio, 45039, United States",,Ohio,45039,2025-10-14T15:12:06.413286,Nominatim
39.336702,-82.981825,224951,YOCTANGEE COC 2,Chillicothe,OH,"ChargePoint, Riverside Street, Chillicothe, Ross County, Ohio, 45601, United States",Chillicothe,Ohio,45601,2025-10-14T15:12:07.698295,Nominatim
39.337545,-82.073212,224953,DONWOODAUTO HYUNDAI 2,Athens,OH,"810, East State Street, Sells Park, Athens, Athens Township, Athens County, Ohio, 45701, United States",Athens,Ohio,45701,2025-10-14T15:12:09.169250,Nominatim
39.369901,-82.132842,224966,8 N PLAINS RURAL ACTION,The Plains,OH,"5, Harper Street, The Plains, Athens Township, Athens County, Ohio, 45780, United States",The Plains,Ohio,45780,2025-10-14T15:12:10.509967,Nominatim
39.37835,-84.51318,224974,TRIHEALTH BBH,Hamilton,OH,"Bethesda Butler Hospital, Hamilton Mason Road, Hamilton, Butler County, Ohio, 45069, United States",Hamilton,Ohio,45069,2025-10-14T15:12:11.952919,Nominatim
39.381377,-84.386281,224976,Liberty Park,Liberty Township,OH,"Liberty Park Mini Bridge, Liberty Township, Butler County, Ohio, 45069, United States",,Ohio,45069,2025-10-14T15:12:13.372971,Nominatim
39.388071,-84.341349,224980,Palmera Apartments,Mason,OH,"Palmera Drive, Heritage Pointe, Deerfield Township, Warren County, Ohio, United States",,Ohio,,2025-10-14T15:12:14.847461,Nominatim
39.396959,-84.451739,224986,Liberty Township Administrative Building,Liberty Township,OH,"Princeton Glendale Road, Carriage Hill, Maustown, Liberty Township, Butler County, Ohio, 45246, United States",,Ohio,45246,2025-10-14T15:12:16.232871,Nominatim
39.397481,-84.561062,224987,HAMILTON OHIO 218 S 3RD ST,Hamilton,OH,"Greater Hamilton Civic Theatre, 215, South 3rd Street, Main Street Historic District, South Hamilton, Hamilton, Butler County, Ohio, 45011, United States",Hamilton,Ohio,45011,2025-10-14T15:12:17.741376,Nominatim
39.4026,-84.567838,224994,HAMILTON OHIO 123 MAIN ST,Ross,OH,"Petals and Wicks, 119, Main Street, Main Street Historic District, Hamilton, Butler County, Ohio, 45013, United States",Hamilton,Ohio,45013,2025-10-14T15:12:19.034649,Nominatim
39.406986,-82.406333,225001,CHERRY RIDGE STATION 1,New Plymouth,OH,"Cherry Ridge Retreat, Cherry Ridge Road, Washington Township, Hocking County, Ohio, 45654, United States",,Ohio,45654,2025-10-14T15:12:20.450532,Nominatim
39.408426,-84.555532,225007,HAMILTON OHIO 790 N. 3RD ST.,Hamilton,OH,"815, North 3rd Street, River View, Warwickshire, Hamilton, Butler County, Ohio, 45011, United States",Hamilton,Ohio,45011,2025-10-14T15:12:21.790974,Nominatim
39.424467,-81.458301,225018,Washington County Public Library,Marietta,OH,"Ellenwood Avenue, Marietta Historic District, West Marietta, Marietta, Washington County, Ohio, 45750, United States",Marietta,Ohio,45750,2025-10-14T15:12:23.446976,Nominatim
39.430691,-84.186746,225023,First National Bank,Lebanon,OH,"1160, East Main Street, Lebanon, Turtlecreek Township, Warren County, Ohio, 45036, United States",Lebanon,Ohio,45036,2025-10-14T15:12:24.811566,Nominatim
39.43088,-84.28346,225024,ODOT District 8 Offices,Lebanon,OH,"Ohio Department of Transportation District 8, SR 741, Ohio Department of Transportation District 8, Turtlecreek Township, Warren County, Ohio, 45040, United States",,Ohio,45040,2025-10-14T15:12:26.266465,Nominatim
39.432195,-83.785387,225025,Airpark Main,Wilmington,OH,"Hunter Drive, Union Township, Clinton County, Ohio, United States",,Ohio,,2025-10-14T15:12:27.568243,Nominatim
39.433275,-84.210856,225026,CITY OF LEBANON STATION #1,Lebanon,OH,"West Main Street, Lebanon Commercial Historic District, Lebanon, Warren County, Ohio, 45036, United States",Lebanon,Ohio,45036,2025-10-14T15:12:29.144284,Nominatim
39.425032,-82.550704,225027,HOCKING HILLS STATION 2,Logan,OH,"Hocking Hills State Park Cabin, Cedar Grove, Benton Township, Hocking County, Ohio, United States",,Ohio,,2025-10-14T15:12:30.567396,Nominatim
39.43384,-84.209306,225029,Golden Lamb,Lebanon,OH,"Johnson Court, Lebanon Commercial Historic District, Lebanon, Warren County, Ohio, 45036, United States",Lebanon,Ohio,45036,2025-10-14T15:12:32.047177,Nominatim
39.440966,-84.408114,225034,Tru-Monroe,Monroe,OH,"Edison Drive, Monroe, Butler County, Ohio, 45044, United States",Monroe,Ohio,45044,2025-10-14T15:12:33.461764,Nominatim
39.442218,-82.561155,225036,Paws & Unwind Cabin,Logan,OH,"20325, Unger Road, Benton Township, Hocking County, Ohio, 43138, United States",,Ohio,43138,2025-10-14T15:12:34.975516,Nominatim
39.444492,-82.554935,225038,Get Lost - Rental Cabin,Logan,OH,"Buckeye/Bridle, Cedar Grove, Benton Township, Hocking County, Ohio, United States",,Ohio,,2025-10-14T15:12:36.360404,Nominatim
39.444902,-83.849149,225040,Bill Marine Ford Inc,Wilmington,OH,"1206, West Main Street, Wilmington, Union Township, Clinton County, Ohio, 45177, United States",Wilmington,Ohio,45177,2025-10-14T15:12:37.856511,Nominatim
39.448081,-83.82814,225045,WILMINGTON EV EV2,Wilmington,OH,"Wilmington Savings Bank, North South Street, Wilmington Commercial Historic District, Wilmington, Clinton County, Ohio, 45177, United States",Wilmington,Ohio,45177,2025-10-14T15:12:39.152900,Nominatim
39.454593,-84.28228,225051,Warren County Armco Park - Golf Pro Shop,Lebanon,OH,"Armco Park Golf Course, SR 741, Otterbein, Turtlecreek Township, Warren County, Ohio, 45040, United States",,Ohio,45040,2025-10-14T15:12:40.615425,Nominatim
39.455894,-84.282907,225056,Warren County Armco Park - Pavilion,Lebanon,OH,"SR 741, Otterbein, Turtlecreek Township, Warren County, Ohio, 45040, United States",,Ohio,45040,2025-10-14T15:12:41.898453,Nominatim
39.45875,-84.26278,225057,Warren County Sports Park,Lebanon,OH,"Greentree Road, The Trails of Shaker Run, Greentree Corners, Turtlecreek Township, Warren County, Ohio, 45036, United States",,Ohio,45036,2025-10-14T15:12:43.349905,Nominatim
39.459997,-82.23158,225063,CITY STATION 2,Nelsonville,OH,"Columbus Street, Nelsonville, Trimble Township, Athens County, Ohio, 45764, United States",Nelsonville,Ohio,45764,2025-10-14T15:12:44.668716,Nominatim
39.461053,-82.231659,225065,Stuart's Opera House - Parking Lot,Nelsonville,OH,"Washington Street, Nelsonville, Trimble Township, Athens County, Ohio, 45764, United States",Nelsonville,Ohio,45764,2025-10-14T15:12:46.123919,Nominatim
39.48972,-84.73094,225085,BUTLERRURALELEC TALAWANDA,Oxford,OH,"Talawanda High School, 5301, University Park Boulevard, Oxford, Oxford Township, Butler County, Ohio, 45056, United States",Oxford,Ohio,45056,2025-10-14T15:12:47.457811,Nominatim
39.499052,-84.744749,225097,MUO CHESTNUT-EAST,Oxford,OH,"West Chestnut Street, Oxford, Oxford Township, Butler County, Ohio, 45056, United States",Oxford,Ohio,45056,2025-10-14T15:12:49.038956,Nominatim
39.506962,-84.720156,225100,MUO DITMER-EAST,Oxford,OH,"Ditmer Parking Lot, Oxford Trenton Road, Oxford, Oxford Township, Butler County, Ohio, 45056, United States",Oxford,Ohio,45056,2025-10-14T15:12:50.326986,Nominatim
39.51222,-84.741455,225103,TRIHEALTH MHMH,Oxford,OH,"McCullough-Hyde Memorial Hospital, 110, North Poplar Street, Oxford, Oxford Township, Butler County, Ohio, 45056, United States",Oxford,Ohio,45056,2025-10-14T15:12:51.799850,Nominatim
39.513681,-84.727809,225104,MUO MARCUM CONF CTR,Oxford,OH,"Miami University, East Chestnut Street, Oxford, Oxford Township, Butler County, Ohio, 45056, United States",Oxford,Ohio,45056,2025-10-14T15:12:53.133781,Nominatim
39.514476,-84.030283,225106,ODNR - Caesar Creek,Waynesville,OH,"Caeser Creek State Park Office, SR 73, Massie Township, Warren County, Ohio, 45068, United States",,Ohio,45068,2025-10-14T15:12:54.544693,Nominatim
39.516437,-84.736509,225107,MUO MILLETT-WEST,Oxford,OH,"WestMillett Lot, University Avenue, Oxford, Oxford Township, Butler County, Ohio, 45056, United States",Oxford,Ohio,45056,2025-10-14T15:12:55.836709,Nominatim
39.535438,-83.438905,225122,Washington Court House,Washington Court House,OH,"178, South Main Street, Washington Court House Commercial Historic District, Washington Court House, Fayette County, Ohio, 43160, United States",Washington Court House,Ohio,43160,2025-10-14T15:12:57.340825,Nominatim
39.538115,-84.232058,225129,Heatherwoode Golf Club,Springboro,OH,"Heatherwoode Golf Club, 88, Heatherwoode Boulevard, Heatherwoode, Springboro, Warren County, Ohio, 45066, United States",Springboro,Ohio,45066,2025-10-14T15:12:58.662052,Nominatim
39.539396,-82.410214,225132,Worthington of Logan Hotel,Logan,OH,"West 2nd Street, Logan, Hocking County, Ohio, 43138, United States",Logan,Ohio,43138,2025-10-14T15:13:00.194583,Nominatim
39.547534,-84.264355,225137,Clearcreek Park,Franklin,OH,"West Lower Springboro Road, Springboro, Franklin Township, Warren County, Ohio, 45066, United States",Springboro,Ohio,45066,2025-10-14T15:13:01.529080,Nominatim
39.559696,-84.3033,225158,FRANKLINWILDCAT CHARGER 1,Franklin,OH,"Benjamin Franklin Way, Franklin, Warren County, Ohio, 45005, United States",Franklin,Ohio,45005,2025-10-14T15:13:03.084841,Nominatim
39.572922,-84.740601,225182,ODNR - Hueston Woods,College Corner,OH,"Main Loop Road, Preble County, Ohio, United States",,Ohio,,2025-10-14T15:13:04.370403,Nominatim
39.588447,-84.238509,225198,Dayton Childrens South,Miamisburg,OH,"Dayton Children's South Campus, 3333, West Tech Road, Miamisburg, Montgomery County, Ohio, 45342, United States",Miamisburg,Ohio,45342,2025-10-14T15:13:05.887605,Nominatim
39.599424,-84.233021,225206,Austin Landing,Miamisburg,OH,"Progress Park Tower, 3601, Rigby Road, Austin Landing, Miamisburg, Miami Township, Montgomery County, Ohio, 45342, United States",Miamisburg,Ohio,45342,2025-10-14T15:13:07.221811,Nominatim
39.605794,-84.226573,225212,Austin Park,Miamisburg,OH,"9898, Summit Point Drive, Miami Township, Montgomery County, Ohio, 45342, United States",,Ohio,45342,2025-10-14T15:13:08.682415,Nominatim
39.611047,-82.93677,225227,BERGER HOSPITAL BERGER 1,CIRCLEVILLE,OH,"Berger Hospital, 600, North Pickaway Street, Circleville Historic District, Circleville, Pickaway County, Ohio, 43113, United States",Circleville,Ohio,43113,2025-10-14T15:13:11.297439,Nominatim
39.626799,-84.177288,225242,VOSS STATION VOSS 1,Dayton,OH,"Voss Hyundai, 766, Miamisburg Centerville Road, Dayton, Washington Township, Montgomery County, Ohio, 45458, United States",Dayton,Ohio,45458,2025-10-14T15:13:12.765874,Nominatim
39.62847,-84.18514,225246,Washington Township RecPlex,Washington Township,OH,"Washington Township Recreation Center, Miamisburg Centerville Road, Washington Township, Montgomery County, Ohio, 45458, United States",,Ohio,45458,2025-10-14T15:13:14.153225,Nominatim
39.636472,-84.226777,225268,Comfort Suites Miamisburg,Miamisburg,OH,"Comfort Suites Miamisburg Dayton South, 42, Prestige Plaza Drive, Shanersville, Miamisburg, Montgomery County, Ohio, 45342, United States",Miamisburg,Ohio,45342,2025-10-14T15:13:15.762734,Nominatim
39.646576,-84.15011,225291,Allure,Centerville,OH,"Courtin Drive, Allure Apartments, Centerville, Montgomery County, Ohio, 45459, United States",Centerville,Ohio,45459,2025-10-14T15:13:17.091288,Nominatim
39.653585,-84.114385,225302,Miami Valley Hospital South,Centerville,OH,"Miami Valley Drive, Centerville, Montgomery County, Ohio, 45440, United States",Centerville,Ohio,45440,2025-10-14T15:13:18.555441,Nominatim
39.654074,-84.115866,225305,Miami Valley Hospital South. - Parking Garage Top Deck,Centerville,OH,"Miami Valley Hospital South, 2400, Miami Valley Drive, Centerville, Montgomery County, Ohio, 45459, United States",Centerville,Ohio,45459,2025-10-14T15:13:19.841517,Nominatim
39.657592,-84.15936,225312,Dorothy Lane Market - Washington Square - Tesla Destination,Dayton,OH,"Helms Shoe Repair, Eastern Drive, Woodbourne, Washington Township, Montgomery County, Ohio, 45459, United States",,Ohio,45459,2025-10-14T15:13:21.268971,Nominatim
39.678068,-84.237854,225331,WEST CARROLLTON THE POINT 1,Dayton,OH,"954, East Central Avenue, West Carrollton, Montgomery County, Ohio, 45449, United States",West Carrollton,Ohio,45449,2025-10-14T15:13:22.591835,Nominatim
39.684025,-83.93025,225341,CITY OF XENIA CITY OF XENIA 1,Xenia,OH,"South King Street, Waterstreet Historic District, Xenia, Greene County, Ohio, 45385, United States",Xenia,Ohio,45385,2025-10-14T15:13:24.169956,Nominatim
39.694319,-84.114013,225346,KETTERING REC CENTER 1,Kettering,OH,"Glengarry Drive, Kettering, Montgomery County, Ohio, 45420, United States",Kettering,Ohio,45420,2025-10-14T15:13:25.423822,Nominatim
39.70742,-84.125973,225369,Delco Park,Dayton,OH,"Delco Park Drive, Kettering, Montgomery County, Ohio, 45420, United States",Kettering,Ohio,45420,2025-10-14T15:13:26.951590,Nominatim
39.712134,-82.544009,225377,Retriev Technologies,Lancaster,OH,"Quarry Road Southeast, Lancaster, Berne Township, Fairfield County, Ohio, United States",Lancaster,Ohio,,2025-10-14T15:13:28.240798,Nominatim
39.723122,-84.121433,225395,Life Connection of Ohio,Kettering,OH,"Research Boulevard, Shakertown, Kettering, Montgomery County, Ohio, 45420, United States",Kettering,Ohio,45420,2025-10-14T15:13:29.844992,Nominatim
39.724136,-82.670061,225397,SCP NORTH LOT,Lancaster,OH,"Mill Park Drive, Lancaster, Hocking Township, Fairfield County, Ohio, 43130, United States",Lancaster,Ohio,43130,2025-10-14T15:13:31.307054,Nominatim
39.728205,-84.058679,225402,AAA Tire and Auto Service Beavercreek,Beavercreek,OH,"AAA Tire & Auto Service, 3321, Dayton-Xenia Road, Zimmerman, Beavercreek, Greene County, Ohio, 45432, United States",Beavercreek,Ohio,45432,2025-10-14T15:13:32.782843,Nominatim
39.731653,-84.142169,225408,Rich’s Pawn Shop,Dayton,OH,"2390, Fauver Avenue, Linden Heights, Oakland, Dayton, Montgomery County, Ohio, 45420, United States",Dayton,Ohio,45420,2025-10-14T15:13:34.110308,Nominatim
39.732059,-84.186211,225409,Element Oakwood,Dayton,OH,"208, Old River Trail, Dayton, Montgomery County, Ohio, 45409, United States",Dayton,Ohio,45409,2025-10-14T15:13:35.603586,Nominatim
39.734314,-84.159551,225412,Ohio's Hospice of Dayton,Dayton,OH,"Irving Avenue, Dayton, Montgomery County, Ohio, 45419, United States",Dayton,Ohio,45419,2025-10-14T15:13:36.902974,Nominatim
39.739314,-84.207292,225424,Five Rivers Health Centers,Dayton,OH,"Five Rivers Health Center, Miami Chapel Road, Patterson, Dayton, Montgomery County, Ohio, 45408, United States",Dayton,Ohio,45408,2025-10-14T15:13:38.460518,Nominatim
39.74019,-82.625886,225429,VC EV VC BEND EV2,Lancaster,OH,"1567, Timbertop Street, Lancaster, Greenfield Township, Fairfield County, Ohio, 43130, United States",Lancaster,Ohio,43130,2025-10-14T15:13:39.763938,Nominatim
39.740837,-83.80755,225432,ZCI General Contracting,Cedarville,OH,"29, West Xenia Avenue, Cedarville, Cedarville Township, Greene County, Ohio, 45314, United States",Cedarville,Ohio,45314,2025-10-14T15:13:41.265431,Nominatim
39.744163,-84.186296,225445,Miami Valley Hospital - Physician's Lot,Dayton,OH,"Miami Valley Hospital, 1, Wyoming Street, Dayton, Montgomery County, Ohio, 45409, United States",Dayton,Ohio,45409,2025-10-14T15:13:42.570098,Nominatim
39.745709,-82.6452,225448,CKOL LVL 2 #1 KOL LEVEL2 #1,Lancaster,OH,"Bob Boyd, Columbus-Lancaster Road Northwest, Greenfield Township, Fairfield County, Ohio, 43130, United States",,Ohio,43130,2025-10-14T15:13:44.024162,Nominatim
39.746051,-84.185405,225449,Miami Valley Hospital - Employee's Lot,Dayton,OH,"Miami Valley Hospital, 1, Wyoming Street, Dayton, Montgomery County, Ohio, 45409, United States",Dayton,Ohio,45409,2025-10-14T15:13:45.309251,Nominatim
39.746762,-84.186023,225451,Apple Street Parking,Dayton,OH,"East Foraker Avenue, Dayton, Montgomery County, Ohio, 45409, United States",Dayton,Ohio,45409,2025-10-14T15:13:46.811525,Nominatim
39.753242,-83.814415,225466,Cedarville University - Wood Hall,Cedarville,OH,"Varsity Drive, Cedarville, Cedarville Township, Greene County, Ohio, 45314, United States",Cedarville,Ohio,45314,2025-10-14T15:13:48.091788,Nominatim
